{
  "run_id": "exp-2026-03-23-a7f3",
  "project": "tiny-lm-baseline",
  "started_at": "2026-03-23T08:12:00Z",
  "status": "completed",
  "metrics": {
    "final_loss": 2.36,
    "tokens_per_sec": 68500,
    "gpu_mem_peak_mib": 4200
  },
  "config_ref": "configs/tinyshakespeare.yaml",
  "artifacts": {
    "checkpoint": "runs/tinyshakespeare_300/ckpt_final.pt",
    "onnx": "artifacts/tiny_gpt.onnx"
  },
  "tags": ["gpu", "char-lm", "onnx-exported"]
}
